<?xml version="1.0" encoding="UTF-8"?>
<a:autok xmlns:a="http://iit.uni-miskolc.hu/xml/autok"
         xmlns:xsi="http://www.w3.org/2001/XMLSchema-instance"
         xsi:schemaLocation="http://iit.uni-miskolc.hu/xml/autok autok.xsd">
  
  <a:auto rendszam="ABC-123">
    <a:marka>Honda</a:marka>
    <a:gyartasi-ev>2013</a:gyartasi-ev>
    <a:szin metalozott="true">fehér</a:szin>
  </a:auto>
  
  <a:auto rendszam="ABC-124">
    <a:marka>Mercedes</a:marka>
    <a:gyartasi-ev>2013</a:gyartasi-ev>
    <a:szin>ezüst</a:szin>
  </a:auto>
  
  <a:auto rendszam="ABC-125">
    <a:marka>BMW</a:marka>
    <a:gyartasi-ev>2014</a:gyartasi-ev>
    <a:szin metalozott="true">fekete</a:szin>
  </a:auto>
  
  <a:auto rendszam="ABC-126">
    <a:marka>BMW</a:marka>
    <a:gyartasi-ev>2014</a:gyartasi-ev>
  </a:auto>
  
  <a:auto rendszam="ABC-127">
    <a:marka>Ferrari</a:marka>
    <a:gyartasi-ev>2014</a:gyartasi-ev>
    <a:szin metalozott="true">piros</a:szin>
  </a:auto>
  
</a:autok>